{
  "$schema": "https://json-schema.org/draft/2020-12/schema",
  "$id": "https://github.com/freedomkk-qfeng/dsh-oidc/schema/enterprise-profile.v1alpha1.schema.json",
  "title": "dsh-oidc Enterprise Profile v1alpha1",
  "type": "object",
  "additionalProperties": false,
  "required": ["schemaVersion", "id", "displayName", "brand", "oidc", "keyBinding", "provider"],
  "properties": {
    "schemaVersion": { "const": "dsh-oidc/v1alpha1" },
    "id": { "$ref": "#/$defs/id" },
    "displayName": { "$ref": "#/$defs/nonEmpty120" },
    "organization": { "$ref": "#/$defs/nonEmpty120" },
    "nativeInstitutionID": { "type": "string", "minLength": 1, "maxLength": 64 },
    "allowInsecureDevelopment": { "type": "boolean", "default": false },
    "insecureDevelopmentOrigin": { "type": "string", "minLength": 8, "maxLength": 2048, "pattern": "^http://" },
    "brand": { "$ref": "#/$defs/brand" },
    "oidc": { "$ref": "#/$defs/oidc" },
    "keyBinding": { "$ref": "#/$defs/keyBinding" },
    "provider": { "$ref": "#/$defs/provider" }
  },
  "allOf": [
    {
      "if": {
        "not": {
          "type": "object",
          "properties": { "insecureDevelopmentOrigin": {} },
          "required": ["insecureDevelopmentOrigin"]
        }
      },
      "then": {
        "type": "object",
        "properties": {
          "oidc": { "type": "object", "properties": { "issuer": { "$ref": "#/$defs/secureEndpointURL" } } },
          "keyBinding": { "type": "object", "properties": { "baseURL": { "$ref": "#/$defs/secureEndpointURL" } } },
          "provider": { "type": "object", "properties": { "baseURL": { "$ref": "#/$defs/secureEndpointURL" } } }
        }
      }
    },
    {
      "if": {
        "type": "object",
        "properties": { "insecureDevelopmentOrigin": {} },
        "required": ["insecureDevelopmentOrigin"]
      },
      "then": { "type": "object", "properties": { "allowInsecureDevelopment": { "const": true } } }
    }
  ],
  "$defs": {
    "id": { "type": "string", "pattern": "^[a-z][a-z0-9-]{0,63}$" },
    "nonEmpty120": { "type": "string", "minLength": 1, "maxLength": 120, "pattern": "^\\S(?:.*\\S)?$" },
    "positiveInteger": { "type": "integer", "minimum": 1, "maximum": 9007199254740991 },
    "httpsURL": { "type": "string", "minLength": 9, "maxLength": 2048, "pattern": "^https://" },
    "secureEndpointURL": { "type": "string", "minLength": 9, "maxLength": 2048, "pattern": "^(https://|http://(localhost|127\\.0\\.0\\.1|\\[::1\\])(?=[:/]))" },
    "endpointURL": { "type": "string", "minLength": 8, "maxLength": 2048, "pattern": "^(https://|http://)" },
    "brand": {
      "type": "object",
      "additionalProperties": false,
      "properties": {
        "productName": { "type": "string", "minLength": 1, "maxLength": 80 },
        "organizationName": { "$ref": "#/$defs/nonEmpty120" },
        "mark": { "type": "string", "minLength": 1, "maxLength": 4 },
        "logoURL": { "type": "string", "minLength": 9, "maxLength": 131072, "pattern": "^(https://|data:image/(png|webp);base64,)" },
        "primaryColor": { "type": "string", "pattern": "^#[0-9a-fA-F]{6}$" },
        "loginTitle": { "type": "string", "minLength": 1, "maxLength": 120 },
        "loginDescription": { "type": "string", "minLength": 1, "maxLength": 500 },
        "supportURL": { "$ref": "#/$defs/httpsURL" }
      }
    },
    "oidc": {
      "type": "object",
      "additionalProperties": false,
      "required": ["issuer", "clientId", "scopes"],
      "properties": {
        "issuer": { "$ref": "#/$defs/endpointURL" },
        "clientId": { "type": "string", "minLength": 1, "maxLength": 256 },
        "scopes": {
          "type": "array",
          "minItems": 2,
          "maxItems": 64,
          "uniqueItems": true,
          "allOf": [
            { "contains": { "const": "openid" } },
            { "contains": { "const": "profile" } }
          ],
          "items": { "type": "string", "minLength": 1, "maxLength": 128, "pattern": "^\\S+$" }
        }
      }
    },
    "keyBinding": {
      "type": "object",
      "additionalProperties": false,
      "required": ["baseURL"],
      "properties": { "baseURL": { "$ref": "#/$defs/endpointURL" } }
    },
    "compat": {
      "type": "object",
      "additionalProperties": false,
      "properties": {
        "supportsDeveloperRole": { "type": "boolean" },
        "supportsStore": { "type": "boolean" },
        "supportsReasoningEffort": { "type": "boolean" },
        "supportsUsageInStreaming": { "type": "boolean" },
        "maxTokensField": { "type": "string", "minLength": 1, "maxLength": 64 },
        "supportsStrictMode": { "type": "boolean" },
        "supportsLongCacheRetention": { "type": "boolean" },
        "thinkingFormat": { "type": "string", "minLength": 1, "maxLength": 64 },
        "requiresReasoningContentOnAssistantMessages": { "type": "boolean" }
      }
    },
    "retryPolicy": {
      "type": "object",
      "additionalProperties": false,
      "required": ["mode"],
      "properties": {
        "mode": { "enum": ["normal", "always"] },
        "maxRetries": { "type": "integer", "minimum": 0, "maximum": 9007199254740991 },
        "retryableCodes": { "type": "array", "minItems": 1, "uniqueItems": true, "items": { "type": "string", "minLength": 1, "maxLength": 128 } },
        "backoff": {
          "type": "object",
          "additionalProperties": false,
          "properties": {
            "initialDelayMs": { "type": "number", "exclusiveMinimum": 0, "maximum": 2147483647 },
            "maxDelayMs": { "type": "number", "exclusiveMinimum": 0, "maximum": 2147483647 },
            "jitterRatio": { "type": "number", "minimum": 0, "maximum": 1 }
          }
        }
      }
    },
    "model": {
      "type": "object",
      "additionalProperties": false,
      "required": ["id"],
      "properties": {
        "id": { "type": "string", "minLength": 1, "maxLength": 256 },
        "name": { "type": "string", "minLength": 1, "maxLength": 256 },
        "input": { "type": "array", "minItems": 1, "maxItems": 2, "uniqueItems": true, "items": { "enum": ["text", "image"] } },
        "contextWindow": { "$ref": "#/$defs/positiveInteger" },
        "maxTokens": { "$ref": "#/$defs/positiveInteger" },
        "reasoning": { "type": "boolean" },
        "reasoningEfforts": {
          "oneOf": [
            { "const": false },
            { "type": "object", "minProperties": 1, "maxProperties": 16, "additionalProperties": { "type": ["string", "null"], "maxLength": 32 } }
          ]
        },
        "compat": { "$ref": "#/$defs/compat" }
      }
    },
    "provider": {
      "type": "object",
      "additionalProperties": false,
      "required": ["id", "adapter", "baseURL", "models"],
      "properties": {
        "id": { "$ref": "#/$defs/id" },
        "displayName": { "$ref": "#/$defs/nonEmpty120" },
        "adapter": { "const": "openai-compatible" },
        "baseURL": { "$ref": "#/$defs/endpointURL" },
        "reasoning": { "type": "string", "minLength": 1, "maxLength": 32 },
        "defaultContextWindow": { "$ref": "#/$defs/positiveInteger" },
        "defaultMaxTokens": { "$ref": "#/$defs/positiveInteger" },
        "maxRequestImageBytes": { "$ref": "#/$defs/positiveInteger" },
        "requestImagePixelBudget": { "$ref": "#/$defs/positiveInteger" },
        "requestImageMaxBytes": { "$ref": "#/$defs/positiveInteger" },
        "streamIdleTimeoutMs": { "$ref": "#/$defs/positiveInteger" },
        "retryPolicy": { "$ref": "#/$defs/retryPolicy" },
        "compat": { "$ref": "#/$defs/compat" },
        "models": { "type": "array", "minItems": 1, "maxItems": 128, "items": { "$ref": "#/$defs/model" } }
      }
    }
  }
}
